{
  "agent_first_name": "Jennifer",
  "agent_last_name": "Harper",
  "agent_phone": "2378788894",
  "agent_email": "agent@example.coms",
  "applicant_first_name": "Albert",
  "applicant_last_name": "Manteras",
  "applicant_email": "albert@example.com",
  "applicant_phone": "01232223333",
  "user_role": "agent",
  "awaiting_determination_at": null,
  "to_be_reviewed_at": null,
  "created_at": "2023-05-23T09:39:04.197+01:00",
  "description": "This is a long winded description, bla bla bla a single storey ground floor rear extension; replacement of existing garage door with brick infill and a new window; replacement of the existing windows with double glazed windows, installation of rooflight",
  "determined_at": null,
  "determination_date": "2024-03-06",
  "id": 2,
  "invalidated_at": null,
  "in_assessment_at": null,
  "payment_reference": "PAY1",
  "payment_amount": "0.0",
  "ownership_certificate": "A",
  "result_flag": "Planning permission / Permission needed",
  "result_heading": "It looks like these changes will need planning permission",
  "result_description": "Based on the information you have provided, we do not think this is eligible for a Lawful Development Certificate",
  "result_override": "This was my reason for rejecting the result",
  "returned_at": null,
  "started_at": null,
  "status": "not_started",
  "target_date": "2023-06-27",
  "withdrawn_at": null,
  "work_status": "proposed",
  "boundary_geojson": {
    "type": "Feature",
    "geometry": {
      "type": "Polygon",
      "coordinates": [
        [
          [
            -0.07716178894042969,
            51.50094238217541
          ],
          [
            -0.07645905017852783,
            51.50053497847238
          ],
          [
            -0.07615327835083008,
            51.50115276135022
          ],
          [
            -0.07716178894042969,
            51.50094238217541
          ]
        ]
      ]
    }
  },
  "assigned_user_name": "Keva Daugherty",
  "assigned_user_role": "reviewer",
  "application_type": "prior_approval",
  "reference": "23-00101-LDCP",
  "reference_in_full": "SWK-23-00101-LDCP",
  "site": {
    "address_1": "11 Abbey Gardens",
    "address_2": "",
    "county": "",
    "town": "WOODMANSTERNE ROAD, LONDON",
    "postcode": "SE16 3RQ",
    "uprn": "100081043511",
    "latitude": "51.4842536",
    "longitude": "-0.0764165"
  },
  "received_date": "2023-05-23T00:00:00.000+01:00",
  "constraints": [
    "Conservation area"
  ],
  "documents": [],
  "published_comments": [],
  "consultee_comments": [],
  "consultation": {
    "end_date": "2023-08-21"
  },
  "make_public": false
}
